source_key	post_url	relevant_text
x_8	https://x.com/tjcapaldi/status/1981307895632327077	The Vitamin is red meat. All other forms of The Vitamin are merely imitating some aspect of red meat.
x_8	https://x.com/Cheldubiduba/status/1981207225143349351	Orthopedic insoles*, electric pan, weighted blanket, ADHD meds, exercises to breath properly, Cold Turkey + timed box for the phone, laundry bag with multiple pockets  That and self compassion uwur   (*I went all my life walking the wrong way 💀)
x_8	https://x.com/MicroBerto/status/1981105100858020257	For me, it was actually removing a couple fat soluble "vitamins" Vitamin A and D3  I was vitamin A toxic, which led to iron overload, and D3 made my joints horrific. I get plenty of sunshine or use a Sperti instead
x_8	https://x.com/EthanAllenMathr/status/1981068013706367008	Vitamin D. Ended my depression and it’s no longer literally painful to wake at 7am.
x_8	https://x.com/D15Ox/status/1981417981566406990	For my brain: a consortium of vitamins, if you will. NAC + Mushroom blend (lions mane, reishi, chaga, cordyceps, turkey tail) + vitamin D + l-theanine.  Side effect (I think, of NAC) is I haven’t had any respiratory illness in >2 years.  For sleep: magnesium bisglycinate.
x_8	https://x.com/StephCardozoPod/status/1981081806100471996	Cutting out folic acid was my vitamin
x_8	https://x.com/BasedAkxzl/status/1981068881465950229	THC  I have been calling it my parenting Vitamin for a while. I wanna play with my kids, whatever they're up to, more patient and less anger, snuggle em up good  I also combine high doses with targeted consumption + rumination and it has dramatically improved my sober motivation
x_8	https://x.com/EdwinaPJones/status/1981017651158909435	Didn’t change my whole life, but Pepcid AC for severe PMS symptoms can be really really helpful. Time release melatonin was incredible for sleep but it messed up my cycle and prolonged the PMS misery so I had to stop
x_8	https://x.com/garganium/status/1981078815104229680	Magnesium glycinate cleared up my sleep issues and leg cramps
x_8	https://x.com/ItmeBigD/status/1981086379242377616	Black seed oil, it’s been majorly improving my gut health and in turn my mental and overall physical health
x_8	https://x.com/LePeanutGallery/status/1981100324564705740	Vitamin D. Was always tired no matter how much I slept, always miserable, and always too low on energy to function until I took vitamin D pills. A healthy amount of vitamin D is 20 or 30+ ng. Turns out despite being outside a lot, my vitamin D count was 9ng
x_8	https://x.com/BigBleuOx/status/1981096232853688554	Balance. If I get good Sleep, food and exercise I’m like a 10x person the next day.
x_8	https://x.com/dogluvr3333/status/1981093728564695462	Augmented NAC but a specific type from Switzerland, advocated by the Zero Spike Project. And R-Lipoic Acid. Both have dramatically improved my metabolic health on my weight loss journey.
x_8	https://x.com/theSiggyB/status/1981207338079179177	Levothyroxine for hypothyroidism made me realize that I had simply been unnecessarily tired for like a decade
x_8	https://x.com/chelinkaj/status/1981080819272683770	Quitting smoking. I’d been doing it heavily for over 14 years and I swear it felt as if I gained like 20 IQ points once I quit (something to do with blood vessel constriction in the brain probably), and I sleep better, get sick less often, have much more energy, etc.
x_8	https://x.com/m_dep3/status/1981127547212747103	Appetite, heart palpitations, energy levels  Potassium
x_8	https://x.com/blankjen/status/1981067391514624396	Choline + inositol to reverse hair thinning/loss and promote healthy regrowth.
x_8	https://x.com/badapunny/status/1981132544654659673	creatine no more brainfog when i take it everyday + i feel like a 24 hour man while still being able to sleep on a whim granted i havent harmed/injured myself much
x_8	https://x.com/florebens/status/1981142930934157414	Magnesium glycinate - a 3 in 1 natural remedy that I swear by. Rest, digestion and overall mood stabilizer ✅
x_8	https://x.com/lithivia/status/1980943858243715515	cutting even minimally processed foods from my diet almost entirely. it's like i stopped the clock ten years ago when i started
x_8	https://x.com/USA2025USA25/status/1981097900798095855	Magnesium.  Turns out my joint pain as a small child on into adulthood was not just random and unrelated.  I'm still amazed that my hands and legs no longer hurt like they did when I was a kid, teen and young adult.
x_8	https://x.com/complicair/status/1981095096591536378	Wellbutrin, Beeminder, and topical MCT oil lol
x_8	https://x.com/justinpoir/status/1981074609618182587	Choline (via sunflower lecithin and CDP-choline)
x_8	https://x.com/CatFoxBassett1/status/1981040298277900397	Magnesium!
x_8	https://x.com/CLE_Lauren/status/1981106727157452942	Iron. Turns out anemia really does slowly kill you.
x_8	https://x.com/johnnyeaster_/status/1981067643122516287	Taking fish oil to cure my severe eczema.
x_8	https://x.com/beefcowboydude/status/1981096341175726172	Iodine and selenium  Took me from 4+ naps a week to 0  But it seems to absolutely wreck some people so 🤷
x_8	https://x.com/Caden2THESEQUEL/status/1981203772534915300	Getting a harder job
x_8	https://x.com/formerly____/status/1981054226437755114	Salt
x_8	https://x.com/G4RYWithafour/status/1981105179954184363	Sleep would be mine if i wasn’t fighting a years-long war to achieve it. Otherwise closest thing ive found is GlyNAC + Sulforaphane
x_8	https://x.com/LfPorsche/status/1981223806912893086	GABA for restless legs/difficulty falling asleep.
x_8	https://x.com/00Dazzle/status/1981086399982903713	Similar with melatonin
x_8	https://x.com/fromjord/status/1981136080289354182	My vitamin was mental.  I didn’t have God.
x_8	https://x.com/Officer_Jet4650/status/1980967183652979106	sugar
x_8	https://x.com/WuSage3/status/1981076258168397851	Vitamin D was happiness in a pill for me. I was exceedingly low
x_8	https://x.com/birdchad88/status/1981274237009834127	Breaking up.
x_8	https://x.com/NickMCThree/status/1981266529065824736	egirls
x_8	https://x.com/Simspice1/status/1981100914351231487	I cannot function without magnesium.  Vitamin e always makes me great but I worry a bit about blood thinning. Once every few weeks I take like 4 b complex per day for 3 days.. highly recommend!
x_8	https://x.com/evenafteridie/status/1981221325525176340	I know it gets hate, but for whatever reason it works for me. Methylene blue.
x_8	https://x.com/trangineer/status/1981115591626002760	Estrogen
x_8	https://x.com/AllNaz1s/status/1981049014075191316	Advanced meditation. 💖🙏🪷
x_8	https://x.com/chinesepeptide/status/1981243434011939063	many such peptides
x_8	https://x.com/secretpinko/status/1981225034153938999	money
x_8	https://x.com/candy__warhoI/status/1981138008402514089	Hydroxyzine & ondansetron
x_8	https://x.com/JustinLesniews3/status/1981363311602995506	Ah diphenhydramine.  The poor man’s Xanax.   You have served me well for the last two decades.    My big vitamin is Kratom.  It got me off weed, alcohol, and pills.   sometimes you have to rob Peter to pay Paul.
x_8	https://x.com/AverageNft/status/1981159809710973324	Methylphenidate ER
x_8	https://x.com/theselowfeet/status/1981003103974666353	Iron
x_8	https://x.com/Nyct0phil3_x/status/1981011953100501318	B12 injections
x_8	https://x.com/SpicyWiener8888/status/1981016268552704361	cat
x_8	https://x.com/biff_clifton/status/1981112046520586582	hot women farting on me
x_8	https://x.com/nickblack/status/1981370688557506561	meth
x_8	https://x.com/Agent_of_GOD_/status/1981142604076241121	Dimethyltryptamine
x_8	https://x.com/lelexxan/status/1981086782406930810	st johns wort
x_8	https://x.com/SC0NSTI0/status/1981112742342738276	Thc
x_8	https://x.com/NaturalMagic777/status/1981080565114646637	Jogging every other day and eating a salad with tomatoes in it in the morning solved almost everything. Went from constant depressive mood to a good mood for the first time in my life.
x_8	https://x.com/autobiophile/status/1981020400562909280	Estrogen. If you're trans you live this out very literally except people have different opinions about whether you should keep taking the vitamin.
x_8	https://x.com/MrMack303/status/1981055413161517312	Magnesium. I've had pain in the back of my knees for 15 years and magnesium cream is the only thing that treats it.  It's still there, but not nearly as severe.
x_8	https://x.com/Sigdrifr/status/1981100256583405702	N-acetyl L tyrosine (NALT) & microdose lithium fixed my mood issues. Glycine put my tendonitis into remission.
r_1	https://www.reddit.com/r/CuratedTumblr/comments/17ejz19/comment/k63svia/?utm_source=share&utm_medium=web3x&utm_name=web3xcss&utm_term=1&utm_content=share_button	I kinda did this to myself after starting Ritalin  Like I was doing my normal job one day and then I realized that I'd been working on the same thing for several hours and I didn't want to slam my head through a wall, and was like damn, is this what Normal People feels like? You can just do stuff you're not hyperfixated on and not feel like you're dragging the Ring through Mordor?
r_1	https://www.reddit.com/r/CuratedTumblr/comments/17ejz19/comment/k63o9rt/?utm_source=share&utm_medium=web3x&utm_name=web3xcss&utm_term=1&utm_content=share_button	this is genuinely how i felt starting estradiol
r_1	https://www.reddit.com/r/CuratedTumblr/comments/17ejz19/comment/k63yv37/?utm_source=share&utm_medium=web3x&utm_name=web3xcss&utm_term=1&utm_content=share_button	Yeah, that's how severe hypothyroidism went for me
r_1	https://www.reddit.com/r/CuratedTumblr/comments/17ejz19/comment/k63qzpc/?utm_source=share&utm_medium=web3x&utm_name=web3xcss&utm_term=1&utm_content=share_button	Isn't this feeling of being unable to express your potential an ADHD thing?
r_1	https://www.reddit.com/r/CuratedTumblr/comments/17ejz19/comment/k64kfud/?utm_source=share&utm_medium=web3x&utm_name=web3xcss&utm_term=1&utm_content=share_button	this is how i felt when i started taking adderall
r_1	https://www.reddit.com/r/CuratedTumblr/comments/17ejz19/comment/k64dxy3/?utm_source=share&utm_medium=web3x&utm_name=web3xcss&utm_term=1&utm_content=share_button	Other than the "collapsing in the street" part, this is actually pretty close to how it works for people who have a particular mutation on the MTHFR gene (affectionately referred to as the "motherfucker" gene.) If you are one of the approximately 10% of people with this mutation, your body has difficulty converting folic acid (Vitamin B9) to its active form, methylfolate. People with this mutation who supplement with methylfolate often report major improvements in mood and concentration.
r_1	https://www.reddit.com/r/CuratedTumblr/comments/17ejz19/comment/k65j3zu/?utm_source=share&utm_medium=web3x&utm_name=web3xcss&utm_term=1&utm_content=share_button	This actually just happened to me a few months ago.....  The Vitamin? Undiagnosed ADHD my beloved
r_1	https://www.reddit.com/r/CuratedTumblr/comments/17ejz19/comment/k666fpb/?utm_source=share&utm_medium=web3x&utm_name=web3xcss&utm_term=1&utm_content=share_button	 When my partner discovered they had sleep apnea, B and D deficiencies, and an allergy to mosquitoes, and were autistic.
r_1	https://www.reddit.com/r/CuratedTumblr/comments/17ejz19/comment/k679m2d/?utm_source=share&utm_medium=web3x&utm_name=web3xcss&utm_term=1&utm_content=share_button	Unironically, my friend has a mom who has MS, and he's been experiencing some mild problems like a muscle in his leg not working, uncontrollable facial movements, stuff like that. Doc told him to take something like 5000 milligrams of Vitamin D, and all that stuff cleared up in a month.  He's still got ADHD and other stuff, but he's a lot happier and I'm happy that the problem was an easy fix by just taking a vitamin. Just hope it's not masking a real problem that'll hurt later, tho 😕
r_1	https://www.reddit.com/r/CuratedTumblr/comments/17ejz19/comment/k68n4cx/?utm_source=share&utm_medium=web3x&utm_name=web3xcss&utm_term=1&utm_content=share_button	Just FYI…we have a higher threshold for B12 deficiency in the US than in Europe. Got some blood work done and the Doc said well your B12 levels are fine in the US but not in other countries so try a supplement and see how you feel. What do you know? Felt much less fatigued!
r_1	https://www.reddit.com/r/CuratedTumblr/comments/17ejz19/comment/k6ee4lj/?utm_source=share&utm_medium=web3x&utm_name=web3xcss&utm_term=1&utm_content=share_button	 unmedicated ADHD be like
t_1	https://www.tumblr.com/caracalliope/730830836356775936/moreover-everyone-gathers-around-to-be/replies/796457430329491456	bupropion!
t_1	https://www.tumblr.com/caracalliope/730830836356775936/moreover-everyone-gathers-around-to-be/replies/794314605357891584	Fiz consulta hoje e a médica disse que minha vitamina D e ferritina tavam baixos. Eu só conseguia pensar nesse post.
t_1	https://www.tumblr.com/caracalliope/730830836356775936/moreover-everyone-gathers-around-to-be/replies/791552286795104256	Said vitamin is NAC but it causes bloating and gives me gas and it’s uncomfortable but mom forces me to take it even if others notice and laugh or show disgust. It doesn’t help with my anxiety
t_1	https://www.tumblr.com/caracalliope/730830836356775936/moreover-everyone-gathers-around-to-be/replies/784609375500271616	Legitimately if you are overweight and have a host of health issues and ur tired all the time your vitamin might be methylfolate.
t_1	https://www.tumblr.com/caracalliope/730830836356775936/moreover-everyone-gathers-around-to-be/replies/784609280076759040	My vitamin is Insulin and Lexapro
t_1	https://www.tumblr.com/caracalliope/730830836356775936/moreover-everyone-gathers-around-to-be/replies/778577825539211264	B12 and D3 double whammy boiii Also maybe iron
t_1	https://www.tumblr.com/caracalliope/730830836356775936/moreover-everyone-gathers-around-to-be/replies/778039892674527232	it was levothyroxine for me
t_1	https://www.tumblr.com/caracalliope/730830836356775936/moreover-everyone-gathers-around-to-be/replies/777690474082336768	Top Surgery; not just because gemder but also because those giant bitches were destroying my spine
t_1	https://www.tumblr.com/caracalliope/730830836356775936/moreover-everyone-gathers-around-to-be/replies/777675778253062144	B12
t_1	https://www.tumblr.com/caracalliope/730830836356775936/moreover-everyone-gathers-around-to-be/replies/777394921326985216	oh iron please come to me
t_1	https://www.tumblr.com/caracalliope/730830836356775936/moreover-everyone-gathers-around-to-be/replies/776139801687687168	adderall
t_1	https://www.tumblr.com/caracalliope/730830836356775936/moreover-everyone-gathers-around-to-be/replies/775218826009821184	Me and dropping out of uni (academia and architecture school suck ass)
t_1	https://www.tumblr.com/caracalliope/730830836356775936/moreover-everyone-gathers-around-to-be/replies/774851074026799104	unfortunately if The Vitamin is antidepressants you won't get people admiring you for living without it you just get told you don't need it and to deal with it
t_1	https://www.tumblr.com/caracalliope/730830836356775936/moreover-everyone-gathers-around-to-be/replies/772138093197279232	yeh, had this actually happen to me in Mexico, but it was malaria, I still need extra electrolytes, it's no fun
t_1	https://www.tumblr.com/caracalliope/730830836356775936/moreover-everyone-gathers-around-to-be/replies/772062426331004928	Magnesium glycinate with D2 & K3, learning B12 is water soluble so you need to replenish halfway through the day
t_1	https://www.tumblr.com/caracalliope/730830836356775936/moreover-everyone-gathers-around-to-be/replies/769089733249957888	still got problems that I need solved by Mystery Vitamin but one thing that completely resolved about 60% of my endless symptoms was literally moving countries. I was dizzy, lethargic, out of breath, nauseous, headachey, and sore 24/7 with no improvement for YEARS until I left singapore and moved to nz. suddenly felt COMPLETELY BETTER???? recently went back to singapore to visit family and all my symptoms are back tenfold. why am I allergic to a country man
t_1	https://www.tumblr.com/caracalliope/730830836356775936/moreover-everyone-gathers-around-to-be/replies/768710140331442176	had the opposite of a deficiency.,, turns out i can't stomach what i AM eating...... lactose intolerant ✌️
t_1	https://www.tumblr.com/caracalliope/730830836356775936/moreover-everyone-gathers-around-to-be/replies/768181477410258944	ADHD meds for me! Not a vitamin but it changed my life
t_1	https://www.tumblr.com/caracalliope/730830836356775936/moreover-everyone-gathers-around-to-be/replies/767788393182658560	Me when I found out that my parents actively chose not to tell me that I have had low blood sugar my whole life and I had to learn this from a doctor when I was 17
t_1	https://www.tumblr.com/caracalliope/730830836356775936/moreover-everyone-gathers-around-to-be/replies/767753480837464064	In all seriousness, we were convinced my brother had a heart condition because his resting pulse was almost 160. Turns out he he had B12 deficiency.
t_1	https://www.tumblr.com/caracalliope/730830836356775936/moreover-everyone-gathers-around-to-be/replies/767324753838080000	thyroid hormone oops you have too much iron and need it bloodlet extremely vitamin D
t_1	https://www.tumblr.com/caracalliope/730830836356775936/moreover-everyone-gathers-around-to-be/replies/765419059381665792	@dreamerwriternstargazer The Vitamin is unconditional acceptance and love ^_^
t_1	https://www.tumblr.com/caracalliope/730830836356775936/moreover-everyone-gathers-around-to-be/replies/765206305083392000	Me when I was very anemic
t_1	https://www.tumblr.com/caracalliope/730830836356775936/moreover-everyone-gathers-around-to-be/replies/765188391376683008	vitamin d and my fucking SADD lmaoooo
t_1	https://www.tumblr.com/caracalliope/730830836356775936/moreover-everyone-gathers-around-to-be/replies/765053812899725312	I'm hoping this happens to me with magnesium
t_1	https://www.tumblr.com/caracalliope/730830836356775936/moreover-everyone-gathers-around-to-be/replies/764727596174000128	me finding out that my spine was congenitally fucked up in a visible way and my parents had medically neglected me my entire life
t_1	https://www.tumblr.com/caracalliope/730830836356775936/moreover-everyone-gathers-around-to-be/replies/764363590195118080	I was depressed and suicidal so they tested my blood. Had a severe B12 deficiency. Took B12 for a long time. Was still depressed and suicidal, but finally had the energy to make real plans!
t_1	https://www.tumblr.com/caracalliope/730830836356775936/moreover-everyone-gathers-around-to-be/replies/764338209406763008	lowkey mine was friends™
t_1	https://www.tumblr.com/caracalliope/730830836356775936/moreover-everyone-gathers-around-to-be/replies/764204595648086016	lsd
t_1	https://www.tumblr.com/caracalliope/730830836356775936/moreover-everyone-gathers-around-to-be/replies/764188396907364352	Mine is lack of estrogen, excess of testosterone, and Vitamin D3 deficiency. PCOS has been the culprit all this time.
t_1	https://www.tumblr.com/caracalliope/730830836356775936/moreover-everyone-gathers-around-to-be/replies/764177551313797120	can it also be adhd meds
t_1	https://www.tumblr.com/caracalliope/730830836356775936/moreover-everyone-gathers-around-to-be/replies/764174902957883392	Mine is folic acid, adult one a day, and apparently anticonvulsants. Got on seizure med and suddenly half the shit I was having trouble with just stopped. Crazy how that happens
t_1	https://www.tumblr.com/caracalliope/730830836356775936/moreover-everyone-gathers-around-to-be/replies/764155540364525568	The opposite, Me getting diagnosed as celiac finding out gluten is the anti vitamin. But also my vitamin d levels were in the trash because of the celiac
t_1	https://www.tumblr.com/caracalliope/730830836356775936/moreover-everyone-gathers-around-to-be/replies/764116334442381312	Me wondering why I can’t do shit followed by low iron, lack of adhd meds, sleep, vitamin D, and probably electrolytes (I don’t know how I’m alive either)
t_1	https://www.tumblr.com/caracalliope/730830836356775936/moreover-everyone-gathers-around-to-be/replies/764114267140177920	Yeah it was vitamin D. It's pretty embarrassing when The Vitamin is*literally* just a vitamin but I'LL TAKE IT.
t_1	https://www.tumblr.com/caracalliope/730830836356775936/moreover-everyone-gathers-around-to-be/replies/764055581082501120	Adhd meds
t_1	https://www.tumblr.com/caracalliope/730830836356775936/moreover-everyone-gathers-around-to-be/replies/760938002816073728	I almost kicked the bucket from a combo of D3 and B12 deficiency. Could barely get out of bed and couldn't remember why or where I even was half the time. I got prescribed 100,000 units of D3 a week for 6 months. Still supposed to take 50000 a week. It happened 3 years ago.
t_1	https://www.tumblr.com/caracalliope/730830836356775936/moreover-everyone-gathers-around-to-be/replies/756780135372439552	Folic Acid! I had been tested for anaemia and was told that my iron levels weren't that bad. Went on a first aid course and the trainer took one look at me and said 'you're anaemic'. we had a chat and he explains that there is more than one type of anaemia. Recommends me folic acid. It costs me £1 for 90 tablets. Suddenly not shivering/tired/light headed/dizzy all the time
t_1	https://www.tumblr.com/caracalliope/730830836356775936/moreover-everyone-gathers-around-to-be/replies/756381308243034112	Me w folic acid and vitamin D deficiency and slightly reduced liver function... plus burnout
t_1	https://www.tumblr.com/caracalliope/730830836356775936/moreover-everyone-gathers-around-to-be/replies/756262327277486080	High key I was magnesium deficient and when a doctor finally figured that out and had me start taking it, my anemia went away, I lost weight, and I don't feel tired all the time anymore.
t_1	https://www.tumblr.com/caracalliope/730830836356775936/moreover-everyone-gathers-around-to-be/replies/756197649845190656	I was 32 years old when I learned I have anemia, and with one little iron pill a day I am no longer constantly exhausted. 🫠
t_1	https://www.tumblr.com/caracalliope/730830836356775936/moreover-everyone-gathers-around-to-be/replies/754302037455405056	It’s adhd and u need dopamine
t_1	https://www.tumblr.com/caracalliope/730830836356775936/moreover-everyone-gathers-around-to-be/replies/748934070917612648	B12 and D3… it’ll mess you up
t_1	https://www.tumblr.com/caracalliope/730830836356775936/moreover-everyone-gathers-around-to-be/replies/748766399697483050	This is what an adult ADHD diagnosis feels like
t_1	https://www.tumblr.com/caracalliope/730830836356775936/moreover-everyone-gathers-around-to-be/replies/748668026128773598	B12 deficient anemia baybee
t_1	https://www.tumblr.com/caracalliope/730830836356775936/moreover-everyone-gathers-around-to-be/replies/748612405673651022	If you're american there's a 93% chance this is fiber. (Only 7% of americans get the bare minimum. so.)
t_1	https://www.tumblr.com/caracalliope/730830836356775936/moreover-everyone-gathers-around-to-be/replies/747227311240421132	this happened to me with iron "HOW are you awake right now" told me the doctor
t_1	https://www.tumblr.com/caracalliope/730830836356775936/moreover-everyone-gathers-around-to-be/replies/746505409207881177	I recently found out I have hypothyroidism and Oh Boy are the meds helping
t_1	https://www.tumblr.com/caracalliope/730830836356775936/moreover-everyone-gathers-around-to-be/replies/741810626369567664	I found out I'm super vitamin d deficient so I'll let you know how it goes lol
t_1	https://www.tumblr.com/caracalliope/730830836356775936/moreover-everyone-gathers-around-to-be/replies/741493323339110164	me when i took adderal for the first time and found out what normal people feel like
t_1	https://www.tumblr.com/caracalliope/730830836356775936/moreover-everyone-gathers-around-to-be/replies/739191741505962028	I started taking iron regularly and felt like Superman 🫥
t_1	https://www.tumblr.com/caracalliope/730830836356775936/moreover-everyone-gathers-around-to-be/replies/737979048897205645	This literally happened to me but I’m just anemic and it didn’t fix my life
t_1	https://www.tumblr.com/caracalliope/730830836356775936/moreover-everyone-gathers-around-to-be/replies/736969910413014920	Need some vitamin D most people are deficient especially if you live somewhere with a long winter
t_1	https://www.tumblr.com/caracalliope/730830836356775936/moreover-everyone-gathers-around-to-be/replies/736572899057737229	the vitamin is the care and love and support my parents failed to provide me with as a child
t_1	https://www.tumblr.com/caracalliope/730830836356775936/moreover-everyone-gathers-around-to-be/replies/736479462613542154	I lack vitamin d and this is me everytime i take it 🤣
t_1	https://www.tumblr.com/caracalliope/730830836356775936/moreover-everyone-gathers-around-to-be/replies/736414162620138328	My husband discovering he's type 1 diabetic in his 30s
t_1	https://www.tumblr.com/caracalliope/730830836356775936/moreover-everyone-gathers-around-to-be/replies/736365063614143534	me when i thought i was dying until i rmbrd im just highly iron deficient
t_1	https://www.tumblr.com/caracalliope/730830836356775936/moreover-everyone-gathers-around-to-be/replies/736187185951513982	Vitamin d
