source_key	post_url	relevant_text
t_1	https://www.tumblr.com/caracalliope/730830836356775936/moreover-everyone-gathers-around-to-be/replies/736089900267953603	Sort of actually happened to me years ago when I fainted twice at work (I had also always suffered mouth ulcers and at said time had a mouth full but didn't think it was connected) went to the drs and found out I was severely low in B12. Years I'd gotten flack from my family that I was just "lazy" and turns out nope. I also know I'd lacked it for years as I'd had the mouth ulcers since childhood and since getting B12 injections? No ulcers thank lordy🙌
t_1	https://www.tumblr.com/caracalliope/730830836356775936/moreover-everyone-gathers-around-to-be/replies/735943951701558704	My chronic pain and low energy levels got slightly better when i started taking vitamin C. It didnt cure me but the pain is more managable in good days. Im glad for the relief however slight. It means its easier to take a hot bath (where I can also use a minty salt scrub  that also helps manage pain levels). It may be worth trying to correct any vitamin deficincies/hormone issues.
t_1	https://www.tumblr.com/caracalliope/730830836356775936/moreover-everyone-gathers-around-to-be/replies/735924389192183729	get checked for vitamin b12 and vitamin D my friends
t_1	https://www.tumblr.com/caracalliope/730830836356775936/moreover-everyone-gathers-around-to-be/replies/734908882770902408	Was asthma for me. Everyone thought I was unathletic “no shame, sports aren’t for everyone” they’d say. Turns out I had undiagnosed asthma for 25 years. I’m actually very athletic it seems. My lungs just don’t work right
t_1	https://www.tumblr.com/caracalliope/730830836356775936/moreover-everyone-gathers-around-to-be/replies/734854556259192872	oh it was D3 for me
t_1	https://www.tumblr.com/caracalliope/730830836356775936/moreover-everyone-gathers-around-to-be/replies/734710088066356815	me, before I went to the Dr and she was like, ya got anemia babes
t_1	https://www.tumblr.com/caracalliope/730830836356775936/moreover-everyone-gathers-around-to-be/replies/734568053101744837	@icedsilver I might have to at this point. I’ve been to the doctor and I am I am iron deficient, vitamin C & D deficient, calcium deficient, potassium deficient and my creatinine is low. No wonder I’m exhausted all the time🥲
t_1	https://www.tumblr.com/caracalliope/730830836356775936/moreover-everyone-gathers-around-to-be/replies/734567933752512493	Find a good multivitamin.  Trust me.
t_1	https://www.tumblr.com/caracalliope/730830836356775936/moreover-everyone-gathers-around-to-be/replies/734427293124166487	This kinda happened to me. Severely low on functional iron bc my body doesn’t absorb it right, and very b12 deficient. I get IV iron transfusions and b12 shots and it’s life changing
t_1	https://www.tumblr.com/caracalliope/730830836356775936/moreover-everyone-gathers-around-to-be/replies/734404004878218274	b12 d3 or just thiamine
t_1	https://www.tumblr.com/caracalliope/730830836356775936/moreover-everyone-gathers-around-to-be/replies/734258422300079706	KARIN this is you w water
t_1	https://www.tumblr.com/caracalliope/730830836356775936/moreover-everyone-gathers-around-to-be/replies/734009322133936588	B12
t_1	https://www.tumblr.com/caracalliope/730830836356775936/moreover-everyone-gathers-around-to-be/replies/733990685714746824	Okay but I actually suffered horribly for years and turns out I had iron and vitamin D deficiency and I literally became a new person after 2 months of supplements 🥹
t_1	https://www.tumblr.com/caracalliope/730830836356775936/moreover-everyone-gathers-around-to-be/replies/733811434578663225	taking magnesium didn't solve all my problems but it solved plenty I previously assumed was unsolvable
t_1	https://www.tumblr.com/caracalliope/730830836356775936/moreover-everyone-gathers-around-to-be/replies/733237329106115434	i fainted once, got an ambulance called and sent to the doctor to do tests, found out I was severely vitamin D deficient, took vitamins for a long time- did not actually make me happy
t_1	https://www.tumblr.com/caracalliope/730830836356775936/moreover-everyone-gathers-around-to-be/replies/733114210735801352	vitamin d
t_1	https://www.tumblr.com/caracalliope/730830836356775936/moreover-everyone-gathers-around-to-be/replies/733029722669597040	Mine: D3, vegetables, Adderall, and sleep
t_1	https://www.tumblr.com/caracalliope/730830836356775936/moreover-everyone-gathers-around-to-be/replies/733017060811902813	I have (had?) anemia and I started taking a multivitamin with that good shit and it's nice to not be the anemic flavor of cold anymore
t_1	https://www.tumblr.com/caracalliope/730830836356775936/moreover-everyone-gathers-around-to-be/replies/732273761212022198	That is what they told me when they found out I had an iron deficiency. My iron level is great now, but I am still struggeling and depressed even though my doctor said I would feel great.
t_1	https://www.tumblr.com/caracalliope/730830836356775936/moreover-everyone-gathers-around-to-be/replies/732001544079826808	Me when I remember to take my iron supplements
t_1	https://www.tumblr.com/caracalliope/730830836356775936/moreover-everyone-gathers-around-to-be/replies/731913523158493342	I had one magnesium/And Vitamin D
t_1	https://www.tumblr.com/caracalliope/730830836356775936/moreover-everyone-gathers-around-to-be/replies/731533965833793727	me when i found out i'm anemic
t_1	https://www.tumblr.com/caracalliope/730830836356775936/moreover-everyone-gathers-around-to-be/replies/731469623432833665	It was B12 for me. I may also be celiac.
t_1	https://www.tumblr.com/caracalliope/730830836356775936/moreover-everyone-gathers-around-to-be/replies/731375301283971799	Me and iron
t_1	https://www.tumblr.com/caracalliope/730830836356775936/moreover-everyone-gathers-around-to-be/replies/731240876507170860	I started iron supplements and felt like Superman 🤷🏻‍♀️
t_1	https://www.tumblr.com/caracalliope/730830836356775936/moreover-everyone-gathers-around-to-be/replies/731215490365609791	getting my critically low b12 back up didn't solve all my problems but it did make me stop thinking helicopters were following me
t_1	https://www.tumblr.com/caracalliope/730830836356775936/moreover-everyone-gathers-around-to-be/replies/731196596668491777	me with iron
t_1	https://www.tumblr.com/caracalliope/730830836356775936/moreover-everyone-gathers-around-to-be/replies/731112995384818943	D3, b12, and iron. My family and friends are really cheering for me and supporting me
t_1	https://www.tumblr.com/caracalliope/730830836356775936/moreover-everyone-gathers-around-to-be/replies/731101388343781092	Hey turns out: most of us are prolly deficient in vitamin D due to being indoors all the time. Get some sunlight injected into your veins
t_1	https://www.tumblr.com/caracalliope/730830836356775936/moreover-everyone-gathers-around-to-be/replies/731092895418247919	Estrogen
t_1	https://www.tumblr.com/caracalliope/730830836356775936/moreover-everyone-gathers-around-to-be/replies/731085475809291246	Salt
t_1	https://www.tumblr.com/caracalliope/730830836356775936/moreover-everyone-gathers-around-to-be/replies/731083498788005550	This actually happened to me once! I was violently sick every morning for 3 years and no one could figure out what was wrong with me. Turns out, the whole time I had a B12 deficiency. I then started taking B12 tablets regularly and I haven’t had it since! 
t_1	https://www.tumblr.com/caracalliope/730830836356775936/moreover-everyone-gathers-around-to-be/replies/731070714733729606	This is the dream, alright. I had it for a few weeks when I started taking NADH, but it didn't last forever.
t_1	https://www.tumblr.com/caracalliope/730830836356775936/moreover-everyone-gathers-around-to-be/replies/731069916210715262	my doctor calling me after my physical to tell me to touch grass or take vitamin d supplements
t_1	https://www.tumblr.com/caracalliope/730830836356775936/moreover-everyone-gathers-around-to-be/replies/731034954532374715	Well, perhaps lucky for you if you're American, most Americans are deficient in vitamin D. Get ~30 minutes of sun around noon outside most days and it'll improve. Makes a huge difference once you're back to acceptable levels.
t_1	https://www.tumblr.com/caracalliope/730830836356775936/moreover-everyone-gathers-around-to-be/replies/731012273879031806	I mean this is me with my vitamin b anemia lol. Everyone and their mum was like “you can have an anemia for something not iron??” Well yeah since I have vitamin b anemia and gotta take a shit load of the vitamin b’s to feel even a crumb like a normal person lol
t_1	https://www.tumblr.com/caracalliope/730830836356775936/moreover-everyone-gathers-around-to-be/replies/730983947367884379	B12, D3, and Iron deficiency in a nutshell
t_1	https://www.tumblr.com/caracalliope/730830836356775936/moreover-everyone-gathers-around-to-be/replies/730941431103618930	ah, B12
t_1	https://www.tumblr.com/caracalliope/730830836356775936/moreover-everyone-gathers-around-to-be/replies/730927052869684885	It happened to me lmao with Anemia lol I was admitted
t_1	https://www.tumblr.com/caracalliope/730830836356775936/moreover-everyone-gathers-around-to-be/replies/730918912691113052	Check ur vitamin D this happened to me and my depression legit cut in half
t_1	https://www.tumblr.com/caracalliope/730830836356775936/moreover-everyone-gathers-around-to-be/replies/730865507362859596	Me when I had a vitamin d level of 7 when the bare minimum is 30 🙃
t_1	https://www.tumblr.com/caracalliope/730830836356775936/moreover-everyone-gathers-around-to-be/replies/730864004283754274	Lowkey when I started actually taking my vitamin d and magically I stopped getting sick every other week
t_1	https://www.tumblr.com/caracalliope/730830836356775936/moreover-everyone-gathers-around-to-be/replies/730850992982434345	this actually kinda happened to me. every time i miss my iron my PTSD symptoms come back full force. i’ll start being like. everyone knows i’m insane and i know the steps of how to open my door and leave it to get food but i can’t do it. i don’t know how. also what does it mean to be a person vs just an animal because i don’t feel like a person. just some feral thing. and things get bad.
t_1	https://www.tumblr.com/caracalliope/730830836356775936/moreover-everyone-gathers-around-to-be/replies/730707365549442496	D3 and iron deficiency. My energy did a complete turn around after correcting these. Helped my depression  too
t_1	https://www.tumblr.com/caracalliope/730830836356775936/moreover-everyone-gathers-around-to-be/replies/730682620264135562	i will also say that i wouldnt expect to actually feel better once vitamin deficiencies are dealt with cause i had literally zero vitamin d once and took an extremely high dose for a bit and didnt feel any different at all
t_1	https://www.tumblr.com/caracalliope/730830836356775936/moreover-everyone-gathers-around-to-be/replies/730653744317694909	this was me I was deficient in stimulants
t_1	https://www.tumblr.com/caracalliope/730830836356775936/moreover-everyone-gathers-around-to-be/replies/730652883410337987	What youre looking for is mold toxicity and everyone should look into it. Most diseases are caused by chronic exposure
t_1	https://www.tumblr.com/caracalliope/730830836356775936/moreover-everyone-gathers-around-to-be/replies/730652059236814275	I actually sorta had that with fainting at work and finding I out I had a B12 deficiency and needed injections. Felt amazing after years of mouth ulcers, no energy and being called "lazy". Sadly couldn't get my injection during lockdown, my doctor retired so now I'm  feeling crap again and I have to get blood tests done again to be able to get prescribed again😭
t_1	https://www.tumblr.com/caracalliope/730830836356775936/moreover-everyone-gathers-around-to-be/replies/730638280059973635	taurine
t_1	https://www.tumblr.com/caracalliope/730830836356775936/moreover-everyone-gathers-around-to-be/replies/730636613897454894	D3
t_1	https://www.tumblr.com/caracalliope/730830836356775936/moreover-everyone-gathers-around-to-be/replies/730634114498696756	And thats how i started taking my antidepressant. Hi, i’m god’s favorite, and welcome to my tedtalk, today i will-
x_11	https://x.com/levelsio/status/1900646060940222600	Kinda  I started lifting weights, eating mostly clean (meat and vegetables) and have way more energy now  I used to lie down in afternoon to chill and take naps  Now never tired!
x_11	https://x.com/a_real_society/status/1900622989336453428	Just doing things gets me to do more things. It can be cyclical, and I'll still have low energy phases, but they get shorter and less frequent
x_11	https://x.com/menhguin/status/1900625620159390004	50% hang around people i like doing work I enjoy while ignoring people I don't like 30% adhd meds 20% general wellness - exercise, sleep etc
x_11	https://x.com/trickylabyrinth/status/1900668284422471815	- a month of daily b complex vitamins (idk if this did anything) - some mindset change along the lines of "I should work more hours if I want to finish stuff quicker" and "recreation can wait until I'm tired"  pretty sure I'm sleeping less than I did before, but it feels fine?
x_11	https://x.com/specialkdelslay/status/1900711455491846545	(mostly) solving the depression helped
x_11	https://x.com/simonsarris/status/1900623534906339701	diet, books, [mumbles] gf  Diet may be essential. Correct outlook definitely essential.
x_11	https://x.com/chasepalmieri/status/1900784509509136429	You start moving and don’t stop. An object in motion tends to stay in motion. Ride the momentum and just get shit done, one thing after the next. ✌️
x_11	https://x.com/HProggy/status/1900643361926816156	Very low energy to ~moderate~ energy; and the solution is that you have to do first, the energy will come after. And, if you don't maintain a minimum cadence, you *will* fall back into a low energy state.
x_11	https://x.com/BitcoinJesus17/status/1900758825587855367	Trade Bitcoin on the five minute chart with 50x leverage
x_11	https://x.com/thombo89/status/1900637706763346343	Modafinil 45min before I actually have to wake up. Or armodafinil.
x_11	https://x.com/Amina_io/status/1900626539953422768	stimulants. stimulants and excercise to be precise. I think the more you lounge around / avoid activity, the more tired you are. Eat a big protein breakfast and take some stimulants if you have to(adderall, vyvanse, coffee etc). Work out. Get good sleep.
x_11	https://x.com/space_treasure8/status/1900736016199413769	fasting  semen retention  regular long walks  early morning spiritual practice  cold showers  quit alcohol & sugar
x_11	https://x.com/therobotjames/status/1900702222314598726	put cocaine up nose
x_11	https://x.com/ReviewsPossum/status/1900779872688931031	I have more energy than most people I know, and the one common denominator is they all drink coffee and I don't, so I guess caffeine dependency is a factor.
x_11	https://x.com/SchrodingrsBrat/status/1900919650394820838	Falling in love always does the trick
x_11	https://x.com/ZherkaOfficial/status/1900692934925902099	Your friend circle
x_11	https://x.com/Soul0Engineer/status/1900638817738256506	Caffeine consumption and lifting more
x_11	https://x.com/metabolicwave/status/1900697798150160605	1) stopped consuming polyunsaturated fats 2) started prioritizing carbohydrate intake from sugar 3) increased coffee and milk consumption to 500mg of caffeine and 1,000mg of calcium  4) started taking daily aspirin 5) started prioritizing Vitamin D and weekly liver consumption
x_11	https://x.com/allie__voss/status/1900623989023617069	Diet, as much as I hate to say it. Specifically lower sugar and lower carbs.
x_11	https://x.com/MagnusVigso/status/1900692960657670241	Royal Jelly is like honey on steroids has numerous of health benefits
x_11	https://x.com/arrtnem/status/1900687905401516313	Fix your sleep, food, movement, and dopamine cycles. Your body isn’t broken, it’s just running on bad fuel. Energy isn’t found, it’s built.
x_11	https://x.com/Plumferno/status/1900697698556096634	B12 and vegan iron capsules (vegan ones digest easier, worth the extra cost, I take "mini" ones from Amazon)  Doesn't work as well if you're a dude, but for a large percentage of women, iron capsules alone will make a world of difference very quickly.
x_11	https://x.com/pegobry_en/status/1900675074278986001	Meth
x_11	https://x.com/braelyn_ai/status/1900672054271373589	i became happy with my life
x_11	https://x.com/BreatheLesss/status/1900831205932617820	Yes, doubling my control pause through Buteyko.
x_11	https://x.com/SlaterHeil/status/1900647841409671355	Yes  It's a very holistic change as much mental as physical  Food, exercise, extremely ambitious goals and constant 'do something' mindset  Lifting was most important because it builds testosterone, and testosterone literally makes your BRAIN feel GOOD for accomplishing things with EFFORT  That association drives doing more things. Becoming a person that does more things with big impact makes you high energy naturally  It all feeds into itself.  Foundation = lots of lifting / pushing self as a habit Great food Lots of big stuff to accomplish Discipline  You will feel like a totally new person and as the system starts working together, your brain will require and it will only feel good to do things, and your body will start producing insane amounts of energy  Good way to kick start is a hard commit to the 75 Hard program
x_11	https://x.com/vpabundance/status/1900733082891940233	My health is through the roof, and its possible for anyone to do:  1. Sleep, minimum 8 hours, no tv or food 2 hours before bed 2. Healthy diet, biggest thing is cutting out sugar and inflammatory foods. 3. Exercise, CrossFit for me is the most challenging thing I've come across, but do what works for you, both aerobic and anaerobic exercises.  Active stretching like Functional Range Conditioning also solid. 4. Meditation, probably the hardest thing for me is settling the mind on a single focal point.  5. Supplements.  Biggest impact for me was mitochondria support (CoQ10 is good) and antioxidants.   6. Low to zero caffeine.   Getting into a regular routine with all of this, takes a bit of time and dedication, but I feel so freaking good throughout my day compared to 5 years ago. 
x_11	https://x.com/JoshConstine/status/1900662363201957983	Only salads for lunch. Sandwiches etc would sap my energy for hours
x_11	https://x.com/TheArtCrusader/status/1900686238358626411	Pray the Rosary and say Christ is King.   Simple as really.
x_11	https://x.com/MikePFrank/status/1900745384181604740	Started doing something with my life that felt more meaningful and worthwhile to me than whatever I was doing before.
x_11	https://x.com/cryptopsychdoc/status/1900648209124364748	yes, but it takes work and constant maintenance, basics to do: - limit caloric intake - limit carb intake daily or just after work-outs - intense exercise at least 4x week - daily walks at least 20-30 minutes, ideally first hr in the morning, with sunlight - no caffeine after 3 pm - sleep 7-9 hrs/night  the change that will made the biggest difference was diet tho, so if you can't do the rest do that first
x_11	https://x.com/kurtwuckertjr/status/1900723295822999827	In order of importance:  1: Sleep consistency 2: Sleep total time 3: Daily exercise 4: Food quantity  5: Food quality
x_11	https://x.com/junker_jo/status/1900686027238379735	thyroid supplementation and unlimited sugar and coffee
x_11	https://x.com/PJaccetturo/status/1900986188171014206	it's always sleep and positive expectancy
x_11	https://x.com/iamtexture/status/1900699853199454598	Cardio first thing in the morning.
x_11	https://x.com/GiaMMacool/status/1901066293836443844	Proper sleep   Clean eating (no chemicals or processed foods)   Over a gallon a water a day   Micro nutrients
x_11	https://x.com/RonakPakzad/status/1900988800890982469	Coffee 1 hour after waking up, sungaze, meditation, workout, eat enough clean protein, quality sleep and spiritual cleanse.
x_11	https://x.com/fishPointer/status/1900652510957683134	amphetamine salts
x_11	https://x.com/RuiCarrilho5/status/1900624983312806383	sleep. absolutely necessary.
x_11	https://x.com/erikdunteman/status/1900674622343070035	Trained for my first marathon and lost a bunch of weight. Night and day life difference
x_11	https://x.com/Glimmerycoin/status/1900808769703211076	Ritalin
x_11	https://x.com/MattACrawford/status/1900983569859621216	Why’s everyone in this thread talking about stims!?  Good food, lifting weights, long walks, meditation, lots of water, positive living + have kids/family.
x_11	https://x.com/ScottyTheCoach/status/1900796248086520052	More sleep, vitamin d + k2 drops, b-vitamins, and recently I started testosterone injections through my physician
x_11	https://x.com/rosesfortywild/status/1900751607358181447	Eating more greens and exercise
x_11	https://x.com/Mqsley/status/1900627897255424021	choline
x_11	https://x.com/TrenXPapi/status/1900797861404831777	The people you surround yourself with
x_11	https://x.com/winnyirl/status/1900685366782554563	sleep
x_11	https://x.com/miragemunny/status/1900657142756966719	diet + exercise is key — what you need to change in that regard, you must discover for yourself
x_11	https://x.com/BreathingByEd/status/1901000225893884217	Reducing daily breathing rate and switching to nasal breathing.
x_11	https://x.com/wminshew/status/1900764053792059780	diet, sunlight, exercise  i still oscillate quite a bit, but these things ~always come and go together
x_11	https://x.com/THEFREEB0Y/status/1900700655209361839	Modafinil fr
x_11	https://x.com/_TomHoward/status/1900658204960276706	Testosterone
x_11	https://x.com/StewartalsopIII/status/1900648436208148540	Goes back and forth but letting go of emotional impressions, the deeper the better, is the only reliable “method” I’ve found to increase energy levels
x_11	https://x.com/GritGrowthCap/status/1901070276596576425	Cocaine
x_11	https://x.com/FerrariJetpack/status/1900674961985147270	sober
x_11	https://x.com/louis030195/status/1901008674786521225	Fasting
x_11	https://x.com/clairekart/status/1900640688728924660	Take iron pills
x_11	https://x.com/adamobrien_/status/1900906497275498496	Cut seed oils and processed sugar
x_11	https://x.com/AndyJScott/status/1900633297769660565	sugar
x_11	https://x.com/degenknght/status/1900793276581495230	Less carbs, more proteins.matcha in the am and gym
x_11	https://x.com/_orcaman/status/1900889909730091392	It’s probably about your personal chemistry, but fasting is an amazing energy booster. Eat only dinner and you’ll be a panther all day long. Eat a big lunch or breakfast and you’ll be tired all day long
x_11	https://x.com/CryptpalSingh/status/1901381847696965667	1. restorative yoga - more energy when my body doesnt have unconscious ache/pain   2. better eating, less sugar - not as many glucose crashes  3. nervous system work - meditation, somatic coaching, therapy/coaching. i now have the most energy i have ever had in life and i can see energy flow in my body. BIGGEST GAME CHANGER  4. working out
x_11	https://x.com/gregory_nico/status/1900892123941032390	Fasting
x_11	https://x.com/psa2rpa/status/1900631484156739711	Quit drinking
x_11	https://x.com/wired0X/status/1900718550438080921	less screen time more activity
x_12	https://x.com/TossitRambles/status/1982503690587299861	I didn't literally collapse obviously, but B6/B12
x_12	https://x.com/etubruton/status/1982511346274230503	not exactly the same thing, but without melatonin I'm incapable of maintaining any kind of reasonable sleep schedule. without it my body will get 4hrs of sleep a night for 2 weeks straight before it will naturally allow me to fall asleep any earlier, and even then it's temporary
x_12	https://x.com/redeemedYIMBY/status/1982561383859605635	Funny enough, it was sugar for me. I was *severely* hypoglycemic without knowing until I turned 19 and got routine bloodwork for the first time.
x_12	https://x.com/GarrettPetersen/status/1982564319079629274	I had a vicious cycle between seasonal allergies, sinus infections, and infections in my upper teeth. Was like having the worst head cold ever repeatedly all the time.  Got allergy injections + root canal + started taking Otrivin when congested. Huge quality of life improvement.
x_12	https://x.com/foxyavelli/status/1982521067223818722	Surgery to fix my deviated septum.   After a week of healing there was a noticeable boost in my ability to breathe, which fixed my insomnia, gave me more energy, improved mental clarity, and made all physical activity easier.
x_12	https://x.com/haskallcurry/status/1982530629091680392	Very boring/well known but exercise changes my hormone levels which then causes me to want different things.
x_12	https://x.com/LexerLux/status/1982562991792111625	Adderall
x_12	https://x.com/realevanslewis/status/1982504174299533718	tell her you're missing vitamin U