source_key	post_url	relevant_text
x_1	https://x.com/moultano/status/1896963022712955029	If you are in this image and you don't like it, try 0.3 mg of melatonin half an hour before bed for a few days. And of course, don't scroll Twitter in bed at bedtime. Read some nonfiction.
x_1	https://x.com/BarbarianChad/status/1897090360326889702	I find that I'm more likely to be deficient in vitamin D, perhaps like many others, and supplementation helps tremendously
x_1	https://x.com/SimoKohonen/status/1896888227430277626	B12 is a pretty good answer here too
x_1	https://x.com/fearmonger69420/status/1896984412719616202	For me it was Vitamins D and B. Did a blood test in college and it changed my life. I firmly believe this is true for many Americans.
x_1	https://x.com/motch_ey/status/1897003224726749232	The vitamin here for me was “friends” and the faking down in the street moment was joining a discord vc after 45 minutes of self-pep-talk.   I was (am) exactly as pathetic as this makes me sound lmfao
x_1	https://x.com/ersatz_0001/status/1896839192359162252	No it's amphetamines
x_1	https://x.com/RezabekA/status/1896900983562911891	for me, it's enough sleep combined with getting the fuck outta my house, or at least getting a morning shower
x_1	https://x.com/jeremyhoffman/status/1896957745842340246	I love my kids but I do miss sleep. One day this year I got to sleep for 10.5 hours. It was incredible. I felt high.
x_1	https://x.com/ErBridgeford/status/1897392051626631661	I wonder if mine was magnesium. I had a liver transplant a few years ago and feel great all the time now. It could be that I spent 4 years slowly dying. But I also have to take an ungodly amount of magnesium now because of medication side effects.
x_1	https://x.com/Bobbertfrasier/status/1897124865007845687	for me it was adderall
x_1	https://x.com/Kat_T_Tsun/status/1897240984536367318	Nah it's water. Keep yo beak wet.
x_1	https://x.com/HeadBetwixKnees/status/1896907413670052159	It's pussy or vitamin d
x_1	https://x.com/tidepoolfruit/status/1896970267471335460	The vitamin for me was water
x_1	https://x.com/lyranem/status/1897181794753241559	estradiol
x_1	https://x.com/Market_Mirage/status/1897100965091922152	I got my genome sequenced when I was 35 and found out that I genetically cannot process most types of vitamin B
x_1	https://x.com/klusek_spaslak/status/1896961428005028048	Not just enough sleep; sleep of appropriate quality, at the right time of night (not 6am-2pm for example)
x_1	https://x.com/OliverBarnum/status/1896968042653077570	I got diagnosed with a neurological sleep disorder, so this basically happened to me. Now my sleep is correct and it turns out I did everything while so tired I might have registered as drunk.
x_3	https://x.com/sympatheticopp/status/1980313229382545608	creatine is weirdly hard to ecplain. the best thing i can say is that to me, creatine is The Vitamin
x_3	https://x.com/raul_1329/status/1980394694199898152	for me, it’s: 1)Low dose naltrexone 2)Serrapeptase 3)Nattokinaise
x_3	https://x.com/fishPointer/status/1980510624699543933	amphetamine
x_3	https://x.com/StevenPWalsh/status/1980391000200900645	I took 50k IU's weekly of Vitamin D, and my energy level went from "can't find the energy to sit" to "normal".  Blood tests showed my level at 14 ng/dL, took years to figure out.
x_3	https://x.com/opendoorforever/status/1980366768079286553	Wrong. Magnesium is the Vitamin.
x_3	https://x.com/dankmemesdoot/status/1980374673172099332	MINE IS LISDEXAMFETAMINE
x_3	https://x.com/mattyjay96/status/1980401335288885413	I'd say the same about cocaine.
x_3	https://x.com/OlLadyOfTheLake/status/1980404898832478390	For me it was folate and Vitamin A. Apparently I'm bad at making them on my own.
x_3	https://x.com/WendigoWear/status/1980408220205347022	Creatine and nicotine fuel my life lol
x_3	https://x.com/mylifeisaplague/status/1980846546251051287	I believe it's sodium for me
x_3	https://x.com/frrntc/status/1981326254487023944	for me the vitamin was magnesium then i saw massive benefits from vitamin D milk and iron and then even more benefit from creatine. plus good sleep that’s a requirement.
x_3	https://x.com/canering/status/1980511802200068144	This actually happened to me and it turns out I’m severely anemic After some iron infusions I do feel better but it’s more like, I don’t pass out when standing up anymore, my life has otherwise not improved much cuz it’s not magic unfortunately Taking adderall (as prescribed and in moderation, not like a manic college finals week binge) did actually have a magical effect though, finally being able to function like a regular person on a daily basis
x_3	https://x.com/SpliceEye/status/1980607772501692471	This was me with an undiagnosed wheat allergy
x_3	https://x.com/Crypto__NoYogi/status/1980692508569960521	I was severely deficient in B12. For some reason my stomach decided it couldn't absorb it anymore (likely alcohol abuse although it manifested while I was 1 yr sober) It caused all kinds of terrifying neurological issues, one of which was that I slowly became retarded.
x_3	https://x.com/l_white_rekords/status/1980387225260167662	It's cocaine
x_3	https://x.com/Tillmann193850/status/1980499159577698603	well the so called vitamin, most probably is testosterone.
x_3	https://x.com/VeAwtizzy/status/1980430553599107154	Vitamin D/K and creatinine having a moment post covid….
x_3	https://x.com/Agent_of_GOD_/status/1980410659868406233	LSD, Ketamine, MDMA, and DMT.
x_3	https://x.com/FatFartFucker/status/1980375152614600901	The vitamin is working out btw
x_3	https://x.com/iBinaryEngineer/status/1981275014566728133	For me it was cocaine
x_3	https://x.com/lanebinn/status/1980563249146802610	This was magnesium for me to an extent
x_3	https://x.com/melanclock/status/1980395555894575379	Vitamin d
x_6	https://x.com/Westoncb/status/1893092437943558308	i remember reading a description from someone who'd had crippling anxiety to the point of being practically agoraphobic for like a decade who fixed some tooth issue that wasn't delivering a conscious pain signal for some reason and the anxiety disappeared immediately
x_6	https://x.com/ChrisCroy/status/1893021342460792887	@senatorshoshana  found out she was suffering from four different kinds of heavy metal poisoning.
x_6	https://x.com/SIUC_SPS/status/1893023083897790521	Indoor CO2 levels perhaps?
x_6	https://x.com/adrianmacneil/status/1892679544324096505	Purchased an air quality monitor, turns out my office has more CO2 than the Jurassic period.   “Brain cognitive function decreases by 50%” 🤯  Why aren’t more ppl talking about this
x_6	https://x.com/louisvarge/status/1893031239713448106	extreme brain fog -> no brain fog, with a gluten free diet
x_6	https://x.com/___frye/status/1893362382740586699	my wife started talking methylfolate and her chronic depression instantly ended
x_6	https://x.com/PstafarianPrice/status/1893001541079941630	@selentelechia  iodine?
x_6	https://x.com/selentelechia/status/1893001760991498274	temporarily, for obvious symptoms of hypothyroid, yes!
x_6	https://x.com/snuppydogg/status/1893034628832755754	my nose bled every single day, at least once per day, until I started taking vitamin k in the morning  weirdly, only the whole foods brand worked  credit to  @zeta_globin
x_6	https://x.com/GeneralAntilles/status/1893006372557508804	for certain subsets of subsets it’s Low-Dose Naltrexone (trauma with dissociation, Hashimoto’s, or both).
x_6	https://x.com/therealchreke/status/1893200178674287073	Cardio definitely has a “The Vitamin” effect on me; the day after is usually like ”wow, I forgot what it’s like to Have Energy”
x_6	https://x.com/soul_needed/status/1893003565498511669	Magnesium for regularity and cramps Lithium for my sister at thanksgiving
x_6	https://x.com/adic_9/status/1893018542314004940	Creatine seems underrated for non gymbros
x_6	https://x.com/kilovh/status/1892977519265030472	A good night's sleep followed by a hot shower, stiff coffee and three advil seems to be the societal concensus. It's really not bad
x_6	https://x.com/mattparlmer/status/1893207850006258060	I was iron deficient for a bit this time last year
x_6	https://x.com/tombielecki/status/1893129259427746295	I got onshotted by this supplement. I had crippling hangovers for close to 10 years (from single drinks). It has completely changed my relationship with alcohol. [Photo of Webber Naturals Liver Health supplement. 65 capsules. Contains Milk Thistle, Schisandra, Alpha Lipoic Acid & Turmeric. Marketed for digestion and liver function protection. White bottle with purple cap, labeled with colorful vegetable graphics at bottom.]
x_6	https://x.com/oscredwin/status/1893331547316511141	Creatine and vitamin B both are pretty good for v*gans
x_6	https://x.com/EvanSandhoefner/status/1893063957729980909	simply walking outside stays underrated
x_6	https://x.com/adic_9/status/1893021348324311422	oh also n acetyl cysteine
x_6	https://x.com/acesounderglass/status/1894100692245103026	Boswelia [link to what looks like a blog describing personal medical miracle story]
x_6	https://x.com/Invertible_Man/status/1893023927300935877	If you’re on twitter reading this you’re probably at least slightly vitamin D deficient. Takes awhile for supplements to have an effect though  5-HTP is great if you suspect you should be on antidepressants  Tyrosine is pretty ok if you suspect you should be on adderall
x_6	https://x.com/Aron_Adler/status/1893086186593300717	undiagnosed ADHD is the archetypal version of this
x_6	https://x.com/nullrespecter/status/1893016584332972482	SAM-e is pretty close. Serotonin precursor and good for your joints. I've been taking Pure Encapsulations brand and I've had much better energy and clarity.  People also recommend a combo of creatine + TMG + and folate if SAM-e doesn't work for you.
x_6	https://x.com/lesser_fool/status/1893037399216664740	At age 19 I learned my grandma had a wheat allergy. Put the pieces together and guessed I might have one too. 2 months later I was 30lbs lighter, chronic pain/fatigue gone, and 10x’d my empathy (to a point that was actually uncomfortable for several months)
x_6	https://x.com/way_opener/status/1893021111303930085	Weirdly for me, iron(this is very unusual for men and not recommended in most cases). But for most people a methylated b complex will probably have better results
x_6	https://x.com/petrocus/status/1892975095154389050	it's just ozempic / steroids / cocaine isn't it
x_6	https://x.com/shakermanjonas/status/1893218606667678032	increasingly looking like i have a histamine intolerance  been on an antihistamine for a week as an experiment and my joint pain's gone away  i've dealt with chronic health crap for 20 years and if it turns out to have been histamine i'll flip my lid
x_6	https://x.com/facts_denier/status/1893058157259207146	thats easy for me:   regular adequate calorie intake
x_6	https://x.com/galcerte/status/1893370045658493105	omega 3. it improved my dry eyes and skin, and more importantly, seems to have gotten me out of depressive ruts I've been having lately. it even made me almost ecstatic at times, and gave me the motivation to do everything I've been postponing lmao
x_6	https://x.com/BloodbathM/status/1893209349096366395	salt. even more salt
x_6	https://x.com/DJAtanasov/status/1893094990563213527	My experience is that many of the B vitamins, specifically thiamine, riboflavin, biotin and B6 have a perceptible feeling within hours upon repletion from even just suboptimal status. The repletion for vitamins A & D is slower but definitely perceptible as well.
x_6	https://x.com/RadagastTBrown/status/1893016039409229941	Not exactly a single substance, but…  Coffee + milk + sugar + L-theanine + Thiamine megadose + B-complex
x_6	https://x.com/caryatis/status/1893382279021351361	I know someone whose v high anxiety suddenly went away after treating hyperthyroidism
x_6	https://x.com/aleksil79/status/1893294971232391477	my absolute favorite The Vitamin is Getting Your Head On Straight And Living Like A Normal Human Being  or on the meta, Knowing You Need The Vitamin bc it sure doesnt occur to anyone to take it otherwise
x_6	https://x.com/aphercotropist/status/1893364989445996741	Magnesium gives me psychic powers
x_6	https://x.com/forgingtowards/status/1893110728246300987	T
x_6	https://x.com/BigBleuOx/status/1893508128173334919	8+ hours of sleep a few nights in a row
x_6	https://x.com/wooltard/status/1893043315550920816	D, Zinc,Mag,K2,
x_6	https://x.com/funkkiy/status/1893265151937179744	vitamin d / vitamin b12 & iron (if anemic)
x_6	https://x.com/ketaset999/status/1893059132250304807	Levothyroxine definitely falls in this category of experience.
x_7	https://x.com/sporadicalia/status/1981210839786147898	for me the Vitamin was legit just Magnesium  it was always that simple, once i started supplementing mag i stopped feeling like crap all the time
x_7	https://x.com/secretmeowth/status/1981218311749980339	WORD  i take magnesium threonine  works great
x_7	https://x.com/abufenyrcd/status/1981305884962639924	D3, Zinc, Magnesium, Creatine & fish oil are my current stack & I feel 10x better since I've been taking it
x_7	https://x.com/gpt_alex/status/1981220553684902024	Double dosing b complex and ltheamine for me… night and day difference
x_7	https://x.com/skyhighbrat/status/1981474272146313539	I remember feeling my best when I was taking magnesium complex and collagen complex but then I stopped.... now lets try again 😅
x_7	https://x.com/ArgyleBlue42/status/1981560975263486131	I just tried magnesium but also mushroom coffee with good nutrition, but lurking cold gone.
x_7	https://x.com/jeremiahjw/status/1981211475848155366	Mine was D3 (turns out I was extremely deficient) and magnesium glycinate a few hours before bed
x_7	https://x.com/javier_bsi/status/1982028733302149313	Collagen, Vitamin C, Creatine, Omega 3, Magnesium and piece of ultra-dark chocolate (90% cocoa) paired with some nuts. This has been very useful to me.
x_7	https://x.com/Quality_LandL/status/1981569956291739866	Creatine, magnesium, l theanine, ashwagandha
x_7	https://x.com/AlanGre68637722/status/1981482885107380232	Magnesium citrate fixed my guts
x_7	https://x.com/ValerieSprague/status/1981236587733405801	B12 for me. I went in and asked for an iron deficiency test because I was tired, and it was B12. Not even that low, but it made a huge difference.
x_8	https://x.com/dissproportion/status/1980830976562397274	Tell me what The Vitamin for you was. Tell me what it was for small parts of your life if you don’t have one big Vitamin.   For me, it was sleep. For my sleep? The Vitamin is Benadryl or Unisom. I’m not fighting it anymore.
x_8	https://x.com/Invertible_Man/status/1980896856969474534	No one’s said vitamin D?   We all get like 0.1% the sunlight/UV exposure our naked savanna-roaming ancestors. If you’re reading this you probably get even less than the average modern human. Milk isn’t enough to save you
x_8	https://x.com/catpoopburglar/status/1981019730640064773	fixing my deviated septum was probably the biggest quality of life jump  you don’t understand how many of your problems are from not breathing well
x_8	https://x.com/ZbynekDrab/status/1981026303487652197	It was a matter of subtraction, not addition: turns out 20 years of untreatable depression, anxiety and insomnia was a dairy intolerance
x_8	https://x.com/Redbarn318/status/1981057832591249540	I don't do this often but if I am really worked up in the evening and I know I am going to have trouble sleeping, I'll drink a good glass of rye whiskey and I'll be able to fall right asleep. Not an alcoholic in any way, but I feel better about a plant-derived sedative than any kind of sleeping pill.
x_8	https://x.com/Cratscadle/status/1980981786261012668	Vitamin d for my skin and hair (and likely mood tbh)  If I take enough creatine in my coffee it doesn’t matter how much I slept. This one is load bearing right now.  Nano hydroxyapatite straight up reversed a nasty cavity for me
x_8	https://x.com/Falafel_face/status/1980916187405189351	Deadlifts 100% eliminated my constant back and knee pain in 3 months
x_8	https://x.com/sunofdopamine/status/1980831160629621032	the vitamin was being around someone who can instantly fix psychological problems until i could do it myself
x_8	https://x.com/sull1vannolan/status/1980862114303750190	As cliche as it sounds lifting weights. Depression fog finally lifted and I got my self confidence back.
x_8	https://x.com/MichaelAlleged/status/1981024452591911205	adderall
x_8	https://x.com/Another_Lab_Rat/status/1980846451426295997	Now try trazodone.  Non addictive and you will wake up even less tired.
x_8	https://x.com/RitaXenia/status/1980836470274552074	Migraine medication
x_8	https://x.com/misslivejournal/status/1981026552105017526	Not drinking a bottle of wine a day
x_8	https://x.com/GregSuburban/status/1981068126537339250	Exercise  IDK about regularly taking Benadryl btw, I've heard that it can cause memory loss and even Alzheimer's/dementia as you age
x_8	https://x.com/KMAG_YOLO/status/1980834575581630527	Chia seeds. Completely changed my life
x_8	https://x.com/tomieinlove/status/1981161430255882360	The Vitamin was losing weight.
x_8	https://x.com/___frye/status/1980858344203325645	sorry. not folic acid, that’s the one to avoid. folate
x_8	https://x.com/OliverBarnum/status/1980883469430370570	i had a neurological sleep disorder called N24 that makes me sleep one hour later into the day each day. i dont medicate it because bludgeoning myself to sleep felt counterproductive compared to just working around it
x_8	https://x.com/rawdogmillionar/status/1980892019225501772	magnesium for sleep, lactoferrin for digestion, shrooms and wellbutrin for having to exist
x_8	https://x.com/DanielleMorrill/status/1981033714101416232	Getting a dog
x_8	https://x.com/doubleunplussed/status/1980962380311122268	Apparently magnesium [Resting heart rate chart (Sep 2022-Sep 2025). Daily readings in pink (50-75 bpm), 30d trimmed mean in black. Shows dramatic 7+ bpm drop during final magnesium supplementation period (green bars), falling from ~65 bpm to ~57 bpm - the steepest sustained decline in the entire 3-year dataset. Earlier Mg periods show modest effects; final period shows exceptional response.]
x_8	https://x.com/girllich1/status/1981262491788423321	Understanding that what I called "being tired" was sunlight triggered migraines.
x_8	https://x.com/dorkweeb/status/1980895993106440206	I had terrible back pain due to bad posture (“keyboard hunch”)  Went away after I started lifting (squats + deadlift + OHP, three times a week), which fixed my posture
x_8	https://x.com/schlynthesis/status/1981125163967267271	san francisco  turns out there is a dedicated region where they store all of the me-shaped people
x_8	https://x.com/Expert_DaddyPig/status/1980981909913256406	First - meeting my wife. Lowered baseline anxiety massively. This is important as it enabled  Second - Adderall. Raises my baseline anxiety but reduces anxiety spikes because I actually accomplish goals I set out for myself. Like 8x higher salary levels of improvement in life.
x_8	https://x.com/eligaultney/status/1981028330850615346	For my sleep it was stopping eating earlier in the day, followed by lower temperature in the bedroom.  Definitely -- sleep has the biggest impact on my sense of well-being
x_8	https://x.com/th1nkp0l/status/1981024238355063232	Lifting (increasing baseline strength is goated)  Skydiving and becoming a tandem instructor (confidence and fear management)
x_8	https://x.com/lydialaurenson/status/1981054920355893372	Temperance, itself, unfortunately appears to be my Vitamin 😹😹😹
x_8	https://x.com/way_opener/status/1981375313096360123	Foam rolling for joints.  Cutting most seed oils for digestive issues (not fully fixed but a lot better) SS-31 for post-exercise malaise (also not fully fixed but a lot better)
x_8	https://x.com/SkyeSharkie/status/1981054289566195783	I'm starting to think it was vitamin D. Lmao.
x_8	https://x.com/lookingat_email/status/1981196365393952866	Self myofascial release  (smashing ones body with pvc pipes and lacrosse balls)  And then exercise in an endless loop
x_8	https://x.com/bonsaicrab/status/1981314309775831297	for me it was growing up
x_8	https://x.com/MinnieMooreLess/status/1981029925781135417	Benadryl is actually really helpful for me because I didn't realize how much I had to clear my throat because of constant allergies and postnasal drip. Unfortunately it makes me sleepy but it's the only allergy med that consistently works for me.
x_8	https://x.com/AnthropoceneMe1/status/1981006000011583862	Tbqh my THE VITAMIN is sugar.    I need more than I think to function properly.
x_8	https://x.com/emptyrivers/status/1981064238321062274	it was water for me 😅  used to get inexplicable bouts of exhaustion to the point of being unable to drive, that went away once i started keeping a big vacuum flask filled with ice & water around
x_8	https://x.com/McNEL608/status/1981104136965017781	sometimes in college, it felt like my heart was racing and i was choking, and it turned out it was because i wasn’t getting any vitamin B in my diet and i just needed to take a normal multivitamin sometimes
x_8	https://x.com/wilfredjame/status/1981211645482586376	The Vitamin for me was a large lacrosse ball; massage before bed every evening. On top of red light and magnesium I’m now sleeping better than I have in years
x_8	https://x.com/JohnnyBlack_HS/status/1981000496241680454	Amphetamine. It also rewired my sleep schedule so i can sleep at 10:30. So both amphetamine, and sleep before 12.
x_8	https://x.com/MausRicochet/status/1981009803951628546	Zinc. Can’t get the levels up but constant supplementation helps.   Second place to Pilates.
x_8	https://x.com/bdmarotta/status/1981080436529942967	For me "the vitamin" has been lowered stress.  Came through a combination of enough sleep, consistent schedule, happy marriage, working out, clearer goals, and more money.
x_8	https://x.com/DanielW_Kiwi/status/1981293178306384362	Sleep without suffocation, CPAP was the answer. Cutting gluten also a big win.
x_8	https://x.com/mattidell/status/1980843226044199148	Amitriptyline. I think it helped me with hormone swings. A lot less being wide awake at 3AM.
x_8	https://x.com/wizardofux/status/1980971453412429965	Vitamin D is my main one  Selenium, MCT oil (coffee), green juice after that
x_8	https://x.com/fash_bandicoot/status/1981274942197977296	For my mom, it was potassium. She started talking nonsense one day and collapsed suddenly. We rushed her to the hospital, assuming she'd had a stroke. I think they gave her three banana bags, and she had to take some chunky supps every day after that.
x_8	https://x.com/pavedwalden/status/1981059161959125243	SAD lights from October through February.
x_8	https://x.com/ChangeUrBeliefs/status/1981120828042588172	diving into the emotions I was avoiding and actually feeling them
x_8	https://x.com/Mariajosehdlg/status/1981093462822007043	My vitamin, potassium. Literally believe and have proven it fixes everything wrong with me.
x_8	https://x.com/i_b_ur_doug/status/1981172058882248780	Mine are altoids. They freshen my breath and have some great acid dropped on them.
x_8	https://x.com/the_roose1/status/1981074637036605524	I have one! I used to regularly get very painful mouth ulcers, to the point where I would have one like 50% of the time. I started taking Vitamin B12 + Lysine and now I barely ever get them, and when I do they clear up very quickly. Life changing
x_8	https://x.com/floidberg/status/1981107801582883198	l-methylfolate
x_8	https://x.com/Bewinxed/status/1981163477424390511	Thyroxin and vitamin D
x_8	https://x.com/ricky_m_w/status/1981161766530028005	Getting enough sleep. Do I take the vitamin? Sometimes.
x_8	https://x.com/CarlPatenaude/status/1981022946366734645	Unironically trazodone for sleep, I'd been an insomniac since at least 9 and this gave me superpowers overnight. I used it to train my body/mind to recognize good sleeping habits and now I need it only infrequently  Otherwise, Karpinski music book; Coulanges society book
x_8	https://x.com/guituary/status/1980888255856828683	I imagine mine is like, being hugged as a toddler. There's no vitamin for it.
x_8	https://x.com/boomyzoomer/status/1981057499173441625	The Vitamin for me is chamomile lol
x_8	https://x.com/NoMetroLA/status/1981114013171012003	My vitamin was pregnancy. Autoimmune issues gone, depression gone, skin clear, strength back.
x_8	https://x.com/FFRoyallty/status/1981071199632277614	Magnesium, vitamin d, iron, K2, but also testosterone. Had no idea my levels were so low and it’s been a night and day difference from the past few years. I had no idea how bad I was really struggling until I wasn’t all of a sudden.
x_8	https://x.com/colehadams/status/1981341645296566720	testosterone cypionate
x_8	https://x.com/SpeaksNanda/status/1981054418133877236	Alas by any reasonable metric I am forced to say "divorce"
x_8	https://x.com/1WholeRabbit/status/1981100578857181525	Apple cider vinegar fixed a major illness I had for a few years.
x_8	https://x.com/phantom_opus/status/1981073605535408279	I think Nattokinase! It's a bit soon to be sure but the few times I've taken it for a few days, I mysteriously just feel much better: more energy and focus, and my planning and memory horizons increase above a few hours  Oh and drinking more water, annoyingly 😤
x_8	https://x.com/KrisUFroll/status/1981105045635485702	That’s horribly anticholinergic and so chronic use is very risky. Melatonin, magnesium, theanine, cortisol lowering adaptogens, improving temperature and sleep hygiene, really going to every effort to avoid induced damage with a first line antihistamine that crosses BBB so easily
